{
  "format": "catto-learning-theme",
  "schema_version": "1.0",
  "theme": {
    "name": "Catto Learning Emergency Recovery",
    "slug": "default",
    "version": "0.5.4",
    "author": "Catto Learning",
    "generated_by": "ChatGPT",
    "created_at": "2026-08-12T02:45:00+02:00",
    "description": "Filesystem recovery theme that also conforms to Catto Learning Theme Package 1.0 conventions."
  },
  "templates": {
    "base": "layouts/base.html",
    "header": "partials/nav.html",
    "footer": "partials/footer.html",
    "sidebar": "partials/nav.html"
  },
  "pages": {},
  "stylesheets": [
    "assets/css/app.css"
  ],
  "scripts": [
    "assets/js/app.js"
  ],
  "assets": [
    "assets/img/hero-learning.svg"
  ],
  "external": {
    "stylesheets": [],
    "scripts": []
  },
  "palettes": {
    "rose": {
      "name": "Rose & Ice",
      "colours": [
        "#64113F",
        "#DE4D86",
        "#F29CA3",
        "#F7CACD",
        "#84E6F8"
      ]
    },
    "citrus": {
      "name": "Citrus",
      "colours": [
        "#EAF2E3",
        "#61E8E1",
        "#F25757",
        "#F2E863",
        "#F2CD60"
      ]
    },
    "ocean": {
      "name": "Ocean & Sun",
      "colours": [
        "#094074",
        "#3C6997",
        "#5ADBFF",
        "#FFDD4A",
        "#FE9000"
      ]
    },
    "signal": {
      "name": "Signal",
      "colours": [
        "#D00000",
        "#FFBA08",
        "#3F88C5",
        "#032B43",
        "#136F63"
      ]
    },
    "woodland": {
      "name": "Woodland",
      "colours": [
        "#606C38",
        "#283618",
        "#FEFAE0",
        "#DDA15E",
        "#BC6C25"
      ]
    },
    "tranquil": {
      "name": "Tranquil",
      "colours": [
        "#1F363D",
        "#40798C",
        "#70A9A1",
        "#9EC1A3",
        "#CFE0C3"
      ]
    }
  },
  "active_palette": "ocean",
  "design": {
    "semantic": {
      "page_background": "#F8FAFC",
      "surface": "#FFFFFF",
      "primary": "palette:0",
      "secondary": "palette:1",
      "accent": "palette:3",
      "heading_text": "auto:page_background",
      "body_text": "auto:page_background",
      "links": "palette:0",
      "navigation_background": "palette:0",
      "navigation_text": "auto:navigation_background",
      "navigation_active": "palette:2",
      "breadcrumb_background": "#FFFFFF",
      "breadcrumb_text": "auto:breadcrumb_background",
      "hero_background": "palette:0",
      "hero_overlay": "palette:3",
      "hero_text": "auto:hero_background",
      "button_primary_background": "palette:0",
      "button_primary_text": "auto:button_primary_background"
    },
    "typography": {
      "preset": "modern",
      "body": "Inter",
      "headings": "Plus Jakarta Sans"
    },
    "layout": {
      "navbar_position": "left",
      "navbar_size": 280,
      "navbar_unit": "px",
      "navbar_sticky": true,
      "navbar_border": true,
      "breadcrumb_visible": true,
      "breadcrumb_position": "below-nav",
      "breadcrumb_height": 78,
      "breadcrumb_show_kicker": true,
      "breadcrumb_show_title": true,
      "content_max_width": 1320,
      "spacing": "comfortable",
      "card_radius": 18,
      "card_border": true,
      "card_shadow": "soft",
      "footer_style": "minimal",
      "nav_items": {
        "home": {
          "visible": true,
          "order": 10
        },
        "catalogue": {
          "visible": true,
          "order": 20
        },
        "help": {
          "visible": true,
          "order": 30
        },
        "company": {
          "visible": true,
          "order": 40
        },
        "account": {
          "visible": true,
          "order": 50
        },
        "administration": {
          "visible": true,
          "order": 60
        },
        "signout": {
          "visible": true,
          "order": 70
        }
      }
    },
    "hero": {
      "enabled": true,
      "asset": "",
      "focal_position": "center",
      "height": 520,
      "overlay_opacity": 35,
      "text_align": "left"
    }
  },
  "advanced_css": null
}